п/н";"Объект";"Адрес";"Округ";"Компания";"Менеджер";"Период обслуживания";"Latitude";"Longitude";"Дата последнего ТО";"Ссылка"
"133948";"ИП Мартиросян Григорий Эдуардович, Пекарня «Буханка»";"Москва , Скандинавский бульвар, 8";"Одинцово";"Эсток-Сервис";"Мозговой И.В.";"КВ";"55.5651224";"37.4986326";"новый";"https://durnovcev2000.kaiten.ru/32511169"
"1473";"ООО ""Аджента""";"г. Москва, Внуковское поселение, б-р Андрея Тарковского, д. 7";"Одинцово";"Гранит";"Пряшников Д.Ю.";"КВ";"55.6268417";"37.3442619";"новый";"#40053126"
"151672";"ООО «Система»/Пекарня Буханк";"Москва, ул. Родниковая,30, корп. 3";"Одинцово";"Гранит";"Ткаченко В.Н.";"КВ";"55.7563482";"37.705974";"новый";"https://durnovcev2000.kaiten.ru/40271273"
"138240";"ООО «ВКУСНО»/пекарня ""Буханка""";"Москва, ул. 1-я Ватутинская, 14, корп. 2";"Одинцово";"Эсток-Сервис";"Ткаченко В.Н.";"КВ";"55.6310176";"37.4039878";"новый";"https://durnovcev2000.kaiten.ru/40686427"
"151684";"ООО «ВКУСНО»/пекарня ""Буханка""";"Сосенское, ул Большое Понизовье, д. 14";"Одинцово";"Гранит";"Ткаченко В.Н.";"КВ";"55.7339252";"37.4104922";"новый";"https://durnovcev2000.kaiten.ru/40271385"
"138951";"ИП Бондаренко Владимир Николаевич (Офис)";"р.п. Заречье, ул. Луговая, д. 6, к. 1";"Одинцово";"Эсток-Сервис";"Ахметкалиев Ф.Х.";"КВ";"55.6856662";"37.4084887";"новый";"https://durnovcev2000.kaiten.ru/48716124"
"138607";"ООО ""Планета Здоровья Холдинг"" / Аптека Планета Здоровья";"г.п. Лесной Городок,ул.Фасадная,д.2,корп.1";"Одинцово";"Эсток-Сервис";"Пряшников Д.Ю.";"КВ";"55.6354473";"37.2156965";"новый";"https://durnovcev2000.kaiten.ru/49510840"
"139117";"ИП Лапаева В.С. пекарня ""Буханка""";"Москва г, ул Чоботовская, д. 2, к. 1";"Одинцово";"Эсток-Сервис";"Ткаченко В.Н.";"КВ";"55.6465492";"37.353032";"новый";"https://durnovcev2000.kaiten.ru/50855393"
"90705";"Аптека ""Планета Здоровья""";"г.Москва, бульвар Дмитрия Донского 11";"Одинцово";"Гранит";"Пряшников Д.Ю.";"М";"55.5664172";"37.5757775";"28.95.2925";"https://durnovcev2000.kaiten.ru/32511284"
"90192";"ИП Рагимова, салон маникюра ""Рай""";"г. Москва, пос. Коммунарка, ул. Александры Монаховой д. 98/2";"Одинцово";"Технологии Безопасности";"Калиниченко А.С.";"КВ";"55.56408399999999";"37.4854898";"-";"#32510753"
"134958";"ООО ""Одинцово Вайнстайл""/(Винный магазин Winestyle)";"Московская обл, Одинцовский р-н, Одинцово г, Можайское ш, дом № 153Г, помещение 2";"Одинцово";"Технологии Безопасности";"Бочкарев";"КВ";"55.7185548";"37.4175429";"06.06.2925";"https://durnovcev2000.kaiten.ru/32511572"
"138326";"ИП ФЕДЫНСКАЯ М.В./ Пекарня « Буханка";"Одинцово, ул Сколковская, д. 3А";"Одинцово";"Технологии Безопасности";"Ткаченко В.Н.";"КВ";"55.6964503";"37.3221494";"06.06.2025";"https://durnovcev2000.kaiten.ru/32511657"
"132368";"ООО ""Планета Здоровья Холдинг"" / Аптека Планета Здоровья";"Московская обл, Одинцовский р-н, Одинцово г, Северная ул, дом № 5, корпус 2";"Одинцово";"Гранит";"Пряшников Д.Ю.";"КВ";"55.6644783";"37.207334";"06.06.2025";"https://durnovcev2000.kaiten.ru/32511577"
"132413";"ООО ""Реон"" / Аптека Планета Здоровья";"Московская обл, Одинцовский р-н, Одинцово г, Можайское ш, дом № 45, помещение 1";"Одинцово";"Гранит";"Пряшников Д.Ю.";"КВ";"55.7185548";"37.4175429";"06.06.2025";"https://durnovcev2000.kaiten.ru/32511571"
"134010";"ИП Новосельцев О.В. /пекарня";"МО , п. ВНИИССОК, ул. Дружбы, дом 2";"Одинцово";"Технологии Безопасности";"Рощин С.С.";"КВ";"55.6586648";"37.199068";"06.06.2025";"https://durnovcev2000.kaiten.ru/32511567"
"134550";"ИП Ташкинова К.Р /Пекарня Буханка";"МО , г.Одинцово , ул. Маршала Бирюзова , 7к3";"Одинцово";"Гранит";"Ткаченко В.Н.";"КВ";"55.6853025";"37.2619836";"06.06.2025";"https://durnovcev2000.kaiten.ru/32511578"
"91422";"Аптека ""Планета Здоровья""";"МО, г. Одинцово , Можайское шоссе, д. 71 Б";"Одинцово";"Гранит";"Пряшников Д.Ю.";"М";"55.6773483";"37.2799671";"06.06.2025";"https://durnovcev2000.kaiten.ru/32511995"
"93048";"Аптека ""Планета ЗДОРОВЬЯ""";"МО, г. Одинцово , Можайское шоссе д.87";"Одинцово";"Гранит";"Пряшников Д.Ю.";"М";"55.6799239";"37.285237";"06.06.2025";"https://durnovcev2000.kaiten.ru/32512007"
"130287";"аптека ""Планета Здоровье"", ООО ""ВЕРБЕНА""";"г. Одинцово, ул. Сколковская, д. 1 Б";"Одинцово";"Гранит";"-";"М";"55.695021";"37.3244185";"06.06.2025";"https://durnovcev2000.kaiten.ru/32511961"
"ТО-279";"ИП Цветков Александр Валерьевич/Пекарня-кондитерская «ЛАКМА»";"Московская обл, Одинцовский р-н, Одинцово г, Маршала Жукова ул, дом № 26";"Одинцово";"Технологии Безопасности";"Чиграй А.С.";"М";"55.6794192";"37.2605422";"06.06.2025";"https://durnovcev2000.kaiten.ru/32511952"
"93029";"ИП Заздравных Мастерская работотехника ""Бустер""";"МО, д. Дрожино, Новое шоссе д.13 пом 1";"Одинцово";"Гранит";"Чиграй А.С.";"М";"55.5270166";"37.5901822";"03.06.2025";"https://durnovcev2000.kaiten.ru/32511324"
"ТО-2319";"ИП Заздравных А.К. Детский клуб ""Book and game""";"МО, д. Дрожжино, Новое шоссе д. 5 к. 1 п. 12";"Одинцово";"Гранит";"Христенко Е.А.";"М";"55.529332";"37.58441";"03.06.2025";"https://durnovcev2000.kaiten.ru/32511306"
"133041";"ИП Козлов Алексей Сергеевич/пункт выдачи OZON";"Московская обл, Одинцовский р-н, Новоивановское рп, бульвар Эйнштейна, дом 1";"Одинцово";"Гранит";"Дубовик А.С.";"КВ";"55.7018101";"37.3611094";"02.06.2025";"https://durnovcev2000.kaiten.ru/32511616"
"133137";"ИП Пашин Николай Дмитриевич/Магазин разливных напитков Ballon";"Московская обл, Одинцовский р-н, Новоивановское рп, бульвар Эйнштейна, дом 1";"Одинцово";"Гранит";"Дубовик А.С.";"КВ";"55.7018101";"37.3611094";"02.06.2025";"https://durnovcev2000.kaiten.ru/32511643"
"ТО№539ТБ";"ИП Сизова Анастасия Николаевна/кофейня Lavendiya";"Одинцовский р-н, раб. пос. Новоивановское, бульвар Эйнштейна, 4";"Одинцово";"Технологии Безопасности";"Чиграй А.С.";"КВ";"55.7018101";"37.3611094";"02.06.2025";"https://durnovcev2000.kaiten.ru/32511614"
"134153";"ИП Тагинцев Михаил Валентинович/Пекарня ""Буханка""";"г.Одинцово , пос.Новоивановское , б-р Эйнштейна, 3";"Одинцово";"Гранит";"Ткаченко В.Н.";"КВ";"55.7013628";"37.3616582";"02.06.2025";"https://durnovcev2000.kaiten.ru/32511436"
"№ 1162ТБ";"ООО «Азбука Строй»/Спа салон";"р. п. Новоивановское, бульвар Энштейна, 4";"Одинцово";"Технологии Безопасности";"Чиграй А.С.";"КВ";"55.7018101";"37.3611094";"02.06.2025";"https://durnovcev2000.kaiten.ru/45204311"
"№ 665ТБ";"ИП Ермолаева И.М., Арт-студия “Forma";"Московская обл, Одинцовский р-н, Новоивановское рп, б-р Эйнштейна,2";"Одинцово";"Технологии Безопасности";"Мозговой И.В.";"КВ";"55.7009177";"37.3602426";"02.06.2025";"https://durnovcev2000.kaiten.ru/32511828"
"130366";"аптека ""Планета Здоровья""";"г.Москва, ул. Татьянин парк, д. 20";"Одинцово";"Гранит";"Пряшников Д.Ю.";"М";"55.6554499";"37.4303079";"02.06.2025";"https://durnovcev2000.kaiten.ru/32511935"
"130702";"ИП Гумирова Екатерина Ренатовна (Детский сад Sun School)";"Москва, деревня Говорово, ул. Центральная, д. 2/1";"Одинцово";"Гранит";"Гунин В.В.";"М";"55.65166480000001";"37.4295591";"02.06.2025";"https://durnovcev2000.kaiten.ru/32511939"
"7937";"Магазин Авоська ООО Авоська два";"г Одинцово ул Сколковская 9 А";"Одинцово";"Аллигатор";"Певзнер Ю.А.";"КВ";"55.6995055";"37.3197113";"30.05.2025";"https://durnovcev2000.kaiten.ru/32511821"
"81962";"Бутик ""HENDERSON""";"МО, г. Одинцово, с. Немчиновка, Хорошевское шоссе, д.14";"Одинцово";"Аллигатор";"Ахметвалиева В.М.";"КВ";"55.720753";"37.378848";"30.05.2025";"https://durnovcev2000.kaiten.ru/32511734"
"91417";"Аптека ""Планета Здоровья""";"г.Москва, ул. Омская 16";"Одинцово";"Гранит";"Пряшников Д.Ю.";"М";"55.6207028";"37.2641002";"30.05.2025";"https://durnovcev2000.kaiten.ru/32510678"
"91418";"Аптека ""Планета Здоровья""";"г.Москва, ул. Омская 5";"Одинцово";"Гранит";"Пряшников Д.Ю.";"М";"55.617861";"37.265720";"30.05.2025";"https://durnovcev2000.kaiten.ru/32510679"
"139263";"ООО «Контакт-М» / офис";"Москва, квартал № 2, 5с1";"Одинцово";"Эсток-Сервис";"Дубовик А.С.";"КВ";"55.755826";"37.6173";"30.05.2025";"https://durnovcev2000.kaiten.ru/49514934"
"138033";"Кафе ""Хачапури тетушки Марико""";"Одинцово, Можайское шоссе, д. 122";"Одинцово";"Технологии Безопасности";"Гусев П.И.";"КВ";"55.6854467";"37.3067278";"30.05.2025";"https://durnovcev2000.kaiten.ru/33958804"
"90711";"Аптека ""Планета Здоровья""";"г.Москва, посёлок Воскресенское, Чечерский проезд 126";"Одинцово";"Гранит";"Пряшников Д.Ю.";"М";"55.5243173";"37.5148939";"28.05.2025";"https://durnovcev2000.kaiten.ru/32511334"
"ТО- № 5497";"ИП Смыслова Олеся Александровна, Детский центр Бэби-клуб";"Москва г, Сосенское п, Коммунарка п, дом № 7А";"Одинцово";"Технологии Безопасности";"Гунин В.В.";"КВ";"55.5704542";"37.4920529";"22.05.2025";"https://durnovcev2000.kaiten.ru/32511172"
"137315";"АО фирма «Агрокомплекс» им. Н. И. Ткачева, магазин № 2002";"Москва г, вн.тер.г. поселение Сосенское, п Коммунарка, ул Александры Монаховой, д. 92, к. 2";"Одинцово";"Гранит";"Писаренко С.";"КВ";"55.5432579";"37.487432";"22.05.2025";"https://durnovcev2000.kaiten.ru/33814889"
"91272";"ООО ""Медальянс""";"Коммунарка, ул. Александры Монаховой 96к2";"Одинцово";"Гранит";"Христенко Е.А.";"КВ";"55.56446709999999";"37.4862021";"22.05.2025";"https://durnovcev2000.kaiten.ru/32511147"
"91631";"""Инвитро""";"г. Москва, поселение Сосенское, п. Коммунарка, улица Александры Монаховой, дом 92, корпус 2";"Одинцово";"Гранит";"Христенко Е.А.";"КВ";"55.5432579";"37.487432";"22.05.2025";"https://durnovcev2000.kaiten.ru/32511154"
"ТО-№ 367ТБ";"Андреева Александра Владимировна (Стоматология)";"Москва г, Сосенское п, Александры Монаховой ул, дом № 94, корпус 2, помещение 5";"Одинцово";"Технологии Безопасности";"Калиниченко А.С.";"КВ";"55.5617843";"37.4871244";"22.05.2025";"https://durnovcev2000.kaiten.ru/32511153"
"139050";"ООО «МедАльянс» / Медицинская лаборатория “ХЕЛИКС”";"Сосенское Александры Монаховой дом 96, корпус 2";"Одинцово";"Гранит";"Христенко Е.А.";"КВ";"55.5644229";"37.4862094";"22.05.2025";"https://durnovcev2000.kaiten.ru/49234630"
"ТО-1020";"ИП Степанова Ксения Сергеевна (Детский сад)";"Москва г, Изюмская ул, дом 57, корпус 1";"Одинцово";"Гранит";"Калиниченко А.С.";"КВ";"55.54363710000001";"37.5640268";"21.05.2025";"https://durnovcev2000.kaiten.ru/32511124"
"ТО-990";"ООО ТПК ""Онком Дистрибуция""";"Москва, ул. Изюмская д.50";"Одинцово";"Гранит";"Пряшников Д.Ю.";"КВ";"55.5438979";"37.5602259";"21.05.2025";"https://durnovcev2000.kaiten.ru/32511137"
"51527";"Магазин продукты, ООО «МИЛИСА» (магазин «Продукты»)";"Москва, ул. Изюмская, д.57/1";"Одинцово";"Технологии Безопасности";"Калиниченко А.С.";"КВ";"55.543531";"37.563557";"21.05.2025";"https://durnovcev2000.kaiten.ru/32511123"
"1667";"ИП Мишин Сергей Владимирович/(Офис)";"Москва, Изюмская, д. 49к4";"Одинцово";"Технологии Безопасности";"Максимов М.Ю.";"КВ";"55.5463991";"37.5657735";"21.05.2025";"https://durnovcev2000.kaiten.ru/42494076"
"93282";"ИП Титов Денис Сергеевич Барбершоп ""Черная кость""";"г. Москва, Знаменские Садки, вл. 1, вс. 1";"Одинцово";"Гранит";"Моторин А.В.";"КВ";"55.5710674";"37.5745061";"21.05.2025";"https://durnovcev2000.kaiten.ru/32511185"
"ТО- № 966ТБ";"ООО «Вектор» / ""Медицинская клиника ""CMD""";"Москва г, ул Адмирала Лазарева, д. 6";"Одинцово";"Технологии Безопасности";"Христенко Е.А.";"КВ";"55.5450156";"37.5426147";"21.05.2025";"https://durnovcev2000.kaiten.ru/36923633"
"1211";"ООО Денталмедсервис, Стоматология";"Москва г,";"Одинцово";"Технологии Безопасности";"Калиниченко А.С.";"КВ";"55.5682395";"37.5624646";"21.05.2025";"https://durnovcev2000.kaiten.ru/32941985"
"93333";"Магазин ""Мирамакс""";"г. Москва, ул. Скобелевская д. 12";"Одинцово";"Гранит";"-";"КВ";"55.54961470000001";"37.5541187";"21.05.2025";"https://durnovcev2000.kaiten.ru/32511213"
"138885";"ИП Савкин Руслан Игоревич";"Москва, бульвар Адмирала Ушакова, дом 8";"Одинцово";"Технологии Безопасности";"Михайлов А.Ю.";"КВ";"55.5482901";"37.5515189";"21.05.2025";"https://durnovcev2000.kaiten.ru/45220773"
"93067";"Аптека Планета Здоровья";"г. Москва ул. Венёвская д.7";"Одинцово";"Гранит";"Пряшников Д.Ю.";"М";"55.5471374";"37.546125";"21.05.2025";"https://durnovcev2000.kaiten.ru/32511295"
"93302";"ООО «Медуница»/Аптека Медуница";"Крылова Татьяна Евгеньевна";"Одинцово";"Гранит";"Полубояринов";"КВ";"55.6235299";"37.3035355";"20.05.2025";"https://durnovcev2000.kaiten.ru/32511762"
"132606";"ООО Таунлаб лаб.служба ""HELIX"" ДЦ Лётчика Ульянина";"г. Москва, пос. Внуковское, ул. Летчика Ульянина, д. 3А, пом. 6";"Одинцово";"Гранит";"Рощин С.С.";"КВ";"55.6252824";"37.30343149999999";"20.05.2025";"https://durnovcev2000.kaiten.ru/32511771"
"130036";"ИП Чернов Антон Юрьевич (Пиццерия «FullFox pizza house»)";"ул. Александры Монаховой, д. 95/3, этаж 1";"Одинцово";"Гранит";"Выволкин";"КВ";"55.5417528";"37.4925483";"20.05.2025";"https://durnovcev2000.kaiten.ru/32511140"
"151681";"ООО «ВОСХОД»/ Пекарня Буханка";"Скандинавский бульвар, 4к1";"Одинцово";"Эсток-Сервис";"Ткаченко В.Н.";"КВ";"55.6820799";"37.7398183";"20.05.2025";"https://durnovcev2000.kaiten.ru/40684837"
"ЭС/Т-1880";"ИП ЧАРКОВ ВЛАДИСЛАВ АНДРЕЕВИЧ / (Салон Красоты «OSNOVA»";"Сосенское, прокшинский проспект 12";"Одинцово";"Эсток-Сервис";"Христенко Е.А.";"КВ";"55.57569650000001";"37.4334381";"20.05.2025";"https://durnovcev2000.kaiten.ru/46255866"
"90255";"Аптека ""Планета Здоровья""";"г.Москва, ул. Лётчика Грицевца 12";"Одинцово";"Гранит";"Пряшников Д.Ю.";"М";"55.62426929999999";"37.3114554";"20.05.2025";"https://durnovcev2000.kaiten.ru/32511911"
"130712";"ООО ""Восток""аптека Планета Здоровья""";"МО, п. Сосенское, б-р Скандинавский, д. 4, корп. 1";"Одинцово";"Гранит";"Пряшников Д.Ю.";"М";"55.5808021";"37.466857";"20.05.2025";"https://durnovcev2000.kaiten.ru/32511369"
"90985";"Аптека ""Планета Здоровья""";"г.Москва, ул. Самуила Маршака 22";"Одинцово";"Гранит";"Пряшников Д.Ю.";"М";"55.6354818";"37.3219672";"20.05.2025";"https://durnovcev2000.kaiten.ru/32511895"
"91586";"Аптека ""Планета Здоровья""";"г.Москва, ул. Корнея Чуковского 3";"Одинцово";"Гранит";"Пряшников Д.Ю.";"М";"55.6364879";"37.3280063";"20.05.2025";"https://durnovcev2000.kaiten.ru/32511907"
"131121";"ИП Фаградян Геворг Гришаевич (Универсам «ММ»)";"г. Москва, ул. Бориса Пастернака, д.45, корп.2";"Одинцово";"Гранит";"Чиграй А.С.";"М";"55.6386727";"37.3078654";"20.05.2025";"https://durnovcev2000.kaiten.ru/32511891"
"137832";"ИП Спиридонов И.И. пекарня ""Буханка""";".Москва, ул. Луговая, 6к1.";"Одинцово";"Эсток-Сервис";"Ткаченко В.Н.";"КВ";"55.68571009999999";"37.3455374";"20.05.2025";"https://durnovcev2000.kaiten.ru/46076619"
"132904";"ИП Арзамасцева Светлана Анатольевна Кафе «Street Loft cafe»";"Москва, п. Десеновское, ул.1-я Нововатутинская, д. 3, пом. 27";"Одинцово";"Гранит";"Мозговой И.В.";"КВ";"55.5172524";"37.3562036";"16.05.2025";"https://durnovcev2000.kaiten.ru/32511239"
"138625";"ИП Мирошниченко Е.С. пекарня Буханка";"Москва, Новосередневский, д. 19";"Одинцово";"Эсток-Сервис";"Ткаченко В.Н.";"КВ";"55.755826";"37.6173";"16.05.2025";"https://durnovcev2000.kaiten.ru/45238626"
"№ 18АС";"ООО Инвест-Капитал, АЗС Радуга";"Атепцево,ул.Левобережье,д.155";"Одинцово";"Аллигатор";"Дубовик А.С.";"КВ";"55.32510749999999";"36.7571185";"16.05.2025";"https://durnovcev2000.kaiten.ru/45478057"
"1468";"ООО «Эко-Инновации» (Офисное помещение)";"Москва г, Десеновское п, Нововатутинский пр-кт, дом № 11, помещение 8";"Одинцово";"Гранит";"Калиниченко А.С.";"КВ";"55.5185501";"37.3485965";"16.05.2025";"https://durnovcev2000.kaiten.ru/32511245"
"134788";"ИП Карпов Артур Владимирович (Кофейня: COFFEE WAY)";"Москва г, Нововатутинская 3-я, д 6.";"Одинцово";"Технологии Безопасности";"Калиниченко А.С.";"КВ";"55.5212908";"37.3494088";"16.05.2025";"https://durnovcev2000.kaiten.ru/32511243"
"133524";"ООО «Восход»/ Пекарня Буханка";"Москва г, пр Куприна, 34к2";"Одинцово";"Эсток-Сервис";"Ткаченко В.Н.";"КВ";"55.540822";"37.455040";"16.05.2025";"https://durnovcev2000.kaiten.ru/32511223"
"ТО-2267";"ИП Болдырева Т.С. / детский центр Фанни Банни";"Москва г, Воскресенское п, дом 4а, помещение 6";"Одинцово";"Гранит";"Калиниченко А.С.";"КВ";"55.5049307";"37.4342345";"16.05.2025";"https://durnovcev2000.kaiten.ru/32511269"
"ЭС/Т-1857/01-25";"ИП Мирошниченко Е.С. пекарня Буханка";"Москва, Усадебный парк, 5";"Одинцово";"Эсток-Сервис";"Ткаченко В.Н.";"КВ";"55.568824";"37.291273";"16.05.2025";"https://durnovcev2000.kaiten.ru/46075787"
"133477";"ИП Жалилов Фарход Хужамбердиевич (Кафе «Плов. Узбекская Кухня»)";"Москва г, Десеновское п, Нововатутинская 6-я ул, дом 1";"Одинцово";"Технологии Безопасности";"Христенко Е.А.";"КВ";"55.5204931";"37.3562952";"16.05.2025";"https://durnovcev2000.kaiten.ru/32511235"
"132478";"ООО ""Планета Здоровья Холдинг"" / Аптека Планета Здоровья";"Москва г пос. Сосенское, Магеллана пр-т , дом № 2";"Одинцово";"Гранит";"Пряшников Д.Ю.";"КВ";"55.5808021";"37.466857";"14.05.2025";"https://durnovcev2000.kaiten.ru/32511179"
"133096";"ООО НПО РЭЙЛ/Аптека планета Здоровья";"Москва г, Сосенское п, Веласкеса б-р, дом 4";"Одинцово";"Гранит";"Пряшников Д.Ю.";"КВ";"55.59295849999999";"37.4576447";"14.05.2025";"https://durnovcev2000.kaiten.ru/32511178"
"134524";"ИП Самохова И.Д./Фитнес студия «На спорте»";"Москва г, Сосенское п, Василия Ощепкова ул, дом № 3";"Одинцово";"Гранит";"Дубовик А.С.";"КВ";"55.554361";"37.4656816";"14.05.2025";"https://durnovcev2000.kaiten.ru/32511107"
"ТО-2420";"ИП Бурхонов Мирбахтиер Урокович Кафе-Пекарня «Восток»";"г. Москва, п. Сосенское, ул. Василия Ощепкова, д. 4";"Одинцово";"Гранит";"Христенко Е.А.";"КВ";"55.55354089999999";"37.4658286";"14.05.2025";"https://durnovcev2000.kaiten.ru/32511112"
"ТО-№ 293ТБ";"ИП Горбунов Сергей Владимирович (Суши Wok)";"Москва г, Сосенское п, Василия Ощепкова ул, дом № 1, помещение 3Н";"Одинцово";"Технологии Безопасности";"Калиниченко А.С.";"КВ";"55.554361";"37.4656816";"14.05.2025";"https://durnovcev2000.kaiten.ru/32511111"
"ТО № 642 ТБ";"ООО «Конкордия»/Учебный центр";"Москва г, Изюмская ул, дом № 50";"Одинцово";"Технологии Безопасности";"Сергеев Н.Р.";"КВ";"55.5480399";"37.5646536";"14.05.2025";"https://durnovcev2000.kaiten.ru/32511134"
"138164";"ИП Гаврилова Юнона Валерьевна/Кладовка ""СКЛАДНО""";"Москва г, Сальвадора Дали ул., д. 1, к. 2";"Одинцово";"Технологии Безопасности";"Гаук Е.М.";"КВ";"55.58847309999999";"37.4444145";"14.05.2025";"https://durnovcev2000.kaiten.ru/40603960"
