п/н";"Объект";"Адрес";"Округ";"Компания";"Менеджер";"Период обслуживания";"Latitude";"Longitude";"Дата последнего ТО";"Ссылка"
"130517";"Гостиница ""Сити""";"г. Москва, ул. Академика Понтрягина д. 11";"Одинцово";"Гранит";"Калиниченко А.С.";"КВ";"55.534684";"37.5009439";"14.05.2025";"https://durnovcev2000.kaiten.ru/32511208"
"91074";"Аптека ""Планета Здоровья""";"г. Москва, р-н Коммунарка, ул. Ясная 5А";"Одинцово";"Гранит";"Пряшников Д.Ю.";"М";"55.5674021";"37.4753009";"14.05.2025";"https://durnovcev2000.kaiten.ru/32511333"
"90406";"Гемотест, ООО Новомед";"г.Москва, ул.Лукинская 16";"Одинцово";"Гранит";"Христенко Е.А.";"КВ";"55.6456817";"37.3390774";"12.05.2025";"https://durnovcev2000.kaiten.ru/32511798"
"131568";"МАХМУДИ АЗИЗ Медицинский много профильный центр ""МОSKOW CLINIC""";"г. Москва, ул. Производственная, д. 10, корп.2";"Одинцово";"Гранит";"Христенко Е.А.";"КВ";"55.6433949";"37.3862717";"12.05.2025";"https://durnovcev2000.kaiten.ru/32511816"
"131928";"ООО ""ГОРИЗОНТ-М"", Магазин ""Алкотека""";"г.Москва, ул.Производственная, д.8, корп.2, пом.7";"Одинцово";"Гранит";"Озеров С.";"КВ";"55.64678499999999";"37.3892467";"12.05.2025";"https://durnovcev2000.kaiten.ru/32511805"
"133146";"ИП Соцкая Татьяна Николаевна (Нежилое помещение)";"Москва г, Авиаторов ул, дом 5, корпус 5";"Одинцово";"Технологии Безопасности";"Гаук Е.М.";"КВ";"55.6404701";"37.3967287";"12.05.2025";"https://durnovcev2000.kaiten.ru/32511785"
"137432";"ИП Педан Дмитрий Сергеевич (Кафе - ресторан “ВкусноHouse”)";"Москва г, ул Юлиана Семёнова, д. 8, к. 2";"Одинцово";"Технологии Безопасности";"Христенко Е.А.";"КВ";"55.64385129999999";"37.3925414";"12.05.2025";"https://durnovcev2000.kaiten.ru/32935162"
"1456";"ООО «РЕНТ ЦЕНТРАЛЬ»/ Ломбард Благо";"Москва г, Шолохова ул, дом 15А";"Одинцово";"Гранит";"Пряшников Д.Ю.";"КВ";"55.641954";"37.3453329";"12.05.2025";"https://durnovcev2000.kaiten.ru/32511800"
"133686";"ГОСУДАРСТВЕННОЕ УЧРЕЖДЕНИЕ ДОПОЛНИТЕЛЬНОГО ПРОФЕССИОНАЛЬНОГО ОБРАЗОВАНИЯ ""УЧЕБНО-МЕТОДИЧЕСКИЙ ЦЕНТР ПО ГРАЖДАНСКОЙ ОБОРОНЕ И ЧРЕЗВЫЧАЙНЫМ СИТУАЦИЯМ ГОРОДА МОСКВЫ""";"Москва г, Богданова ул, дом 58";"Одинцово";"Нева-2";"Шагров Д.Д.";"М";"55.6478126";"37.3913741";"12.05.2025";"https://durnovcev2000.kaiten.ru/32511925"
"138516";"Аптека ""Планета здоровья""";"г.Москва, ул. Шолохова 12";"Одинцово";"Гранит";"Пряшников Д.Ю.";"М";"55.6388407";"37.3523886";"12.05.2025";"https://durnovcev2000.kaiten.ru/32511923"
"137350";"ИП Храмова Наталья Владимировна (Салон красоты ""Лаванда"")";"Московская обл, г.о. Одинцовский, г Голицыно, б-р Генерала Ремезова, д. 10";"Одинцово";"Технологии Безопасности";"Михайлов А.Ю.";"КВ";"55.6198811";"36.9773711";"07.05.2025";"https://durnovcev2000.kaiten.ru/32941977"
"136851";"АО «2ЛАБ» (Медицинский центр «2 LAB»)";"Московская обл, Одинцовский р-н, Одинцово г, Чистяковой ул, дом № 67";"Одинцово";"Технологии Безопасности";"Христенко Е.А.";"КВ";"55.6981771";"37.3221851";"07.05.2025";"https://durnovcev2000.kaiten.ru/32511822"
"134578";"ИП Лопатин Александр Максимович/Пекарня«ЛАКМА»";"Московская обл, Одинцовский р-н, Одинцово г, Северная ул, дом № 5, корпус 3, помещение 14";"Одинцово";"Технологии Безопасности";"Чиграй А.С.";"КВ";"55.6644783";"37.207334";"07.05.2025";"https://durnovcev2000.kaiten.ru/32511776"
"ТО№ 423ТБ";"Потребительский жилищно-строительный кооператив ""Подушкино-таун""/жилые застройки";"Одинцовский р-н, д. Подушкино, «Подушкино-ТАУН» , д. 1";"Одинцово";"Технологии Безопасности";"Епуре А.А.";"КВ";"55.712687";"37.270138";"07.05.2025";"https://durnovcev2000.kaiten.ru/32511782"
"1552";"ИП Ташкинова Кадрия Рашитовна/Пекарня «Буханка»";"Одинцово, мкр. Клубничное Поле, д. 2";"Одинцово";"Гранит";"Мозговой И.В.";"КВ";"55.67337449999999";"37.2818569";"07.05.2025";"https://durnovcev2000.kaiten.ru/42486216"
"93039";"Аптека ""Планета Здоровья""";"МО, ВНИИСОК 4а, ул. Дениса Давыдова д.11";"Одинцово";"Гранит";"Пряшников Д.Ю.";"М";"55.6605";"37.225037";"05.05.2025";"https://durnovcev2000.kaiten.ru/32511990"
"2378";"ИП Коробков А.Н./Додо пицца";"МО, г. Одинцово, Можайское шоссе, 112А";"Одинцово";"Гранит";"Гусев П.И.";"КВ";"55.685263";"37.302948";"05.05.2025";"https://durnovcev2000.kaiten.ru/32511826"
"134701";"ИП Седукина Карина Олеговна (Озон/Ozon)";"Московская обл, Одинцовский р-н, Новоивановское рп, Эйнштейна бульвар, дом 4";"Одинцово";"Технологии Безопасности";"Калиниченко А.С.";"КВ";"55.7018101";"37.3611094";"05.05.2025";"https://durnovcev2000.kaiten.ru/32511838"
"91297";"ИП Цветков Александр Валерьевич (Пекарня-кондитерская «ЛАКМА»)";"МО, г. Одинцово, ул. Маршала Толубко, д. 3, корп. 2";"Одинцово";"Гранит";"Чиграй А.С.";"М";"55.6810376";"37.2970362";"05.05.2025";"https://durnovcev2000.kaiten.ru/32511962"
"135031";"ООО «Система»/Пекарня Буханка";"Москва г, Родниковая ул, дом 30, корпус 2";"Одинцово";"Эсток-Сервис";"Ткаченко В.Н.";"КВ";"55.6310176";"37.4039878";"25.04.2025";"https://durnovcev2000.kaiten.ru/32511783"
"138624";"ИП ГОГЛЕВА АЛЕНА ВАЛЕРЬЕВНА/ Салон Красоты “Gogleva nail studio”";"Московская обл, Наро-Фоминск г, Свободы пл, дом 4";"Одинцово";"Эсток-Сервис";"Христенко Е.А.";"КВ";"55.3855042";"36.7281294";"25.04.2025";"https://durnovcev2000.kaiten.ru/32510914"
"136169";"ИП Карпов Артур Владимирович, Кофейня COFFEE WAY";"Москва г, Сосенское п, пр.Магеллана,5";"Одинцово";"Технологии Безопасности";"Калиниченко А.С.";"КВ";"55.590337";"37.4439635";"24.04.2025";"https://durnovcev2000.kaiten.ru/32511273"
"137839";"ИП Заяц Максим Валентинович (Массажный салон «Мой Тай»)";"Москва г, Сосенское п, Веласкеса б-р, дом № 5, корпус 3";"Одинцово";"Технологии Безопасности";"Христенко Е.А.";"КВ";"55.5936461";"37.4576161";"24.04.2025";"https://durnovcev2000.kaiten.ru/36256903"
"91273";"Стомотология ""ТИП-ТОП""";"Боровское шоссе . Д. 2а, к. 1";"Одинцово";"Гранит";"Христенко Е.А.";"КВ";"55.6607027";"37.4122327";"23.04.2025";"https://durnovcev2000.kaiten.ru/32511843"
"133523";"ООО ""Альфа""/ аптека Планета Здоровья";"Москва г, Боровское ш, дом 2, корпус 5";"Одинцово";"Гранит";"Пряшников Д.Ю.";"КВ";"55.6619147";"37.4199145";"23.04.2025";"https://durnovcev2000.kaiten.ru/32511860"
"134437";"ВКУСНО ООО/ Пекарня Буханка";"Москва г, Боровское ш., дом № 2, корпус 4";"Одинцово";"Эсток-Сервис";"Ткаченко В.Н.";"КВ";"55.6222401";"37.28101";"23.04.2025";"https://durnovcev2000.kaiten.ru/32511852"
"137492";"ООО ""НПО РЭЙЛ"" / аптека ПЗ";"Москва г, вн.тер.г. муниципальный округ Ново-Переделкино, ш. Боровское, д. 27, к. 1";"Одинцово";"Гранит";"Пряшников Д.Ю.";"КВ";"55.6441867";"37.3665427";"23.04.2025";"https://durnovcev2000.kaiten.ru/32511859"
"713ТБ";"ИП Шпак Денис Александрович/Магазин ""Место Пиво""";"Москва г, Боровское ш., дом № 2, корпус 4";"Одинцово";"Технологии Безопасности";"Мозговой И.В.";"КВ";"55.6222401";"37.28101";"23.04.2025";"https://durnovcev2000.kaiten.ru/32511850"
"132327";"ООО «АС-ДЕНТАЛ» Испанский стоматологический центр";"г. Москва, п. Сосенское, бульвар Веласкеса, д.3, к.3, пом. XVII";"Одинцово";"Нева-Технологии";"Мозговой И.В.";"КВ";"55.59319869999999";"37.45724209999999";"23.04.2025";"https://durnovcev2000.kaiten.ru/32511253"
"138554";"ИП Богорова Дарья Витальевна / Кальянная «Мята Lounge»";"п. Сосенское, проспект Прокшинский, дом 12";"Одинцово";"Технологии Безопасности";"Христенко Е.А.";"КВ";"55.57569650000001";"37.4334381";"23.04.2025";"https://durnovcev2000.kaiten.ru/44541350"
"133948хх";"ИП Асланова Наида Демиргаяевна  Пекарня «Буханка»";"Москва , Скандинавский бульвар, 8";"Одинцово";"Эсток-Сервис";"Мозговой И.В.";"КВ";"55.5651224";"37.4986326";"23.04.2025";"https://durnovcev2000.kaiten.ru/32511169"
"151475";"ООО «САНЛАЗЕР» Клиника лазерной эпиляции SUNLASER";"Москва г, Боровское ш., дом 2А, корпус 2";"Одинцово";"Технологии Безопасности";"Калиниченко А.С.";"КВ";"55.6614641";"37.4129831";"21.04.2025";"https://durnovcev2000.kaiten.ru/32511841"
"ТО-№ 403ТБ";"ООО ""Диалмедик"" (Медицинский центр ""СMD"" - анализы)";"Москва г, Боровское ш., дом № 2, корпус 7";"Одинцово";"Технологии Безопасности";"Христенко Е.А.";"КВ";"55.6222401";"37.28101";"21.04.2025";"https://durnovcev2000.kaiten.ru/32511849"
"132289";"ИП Фаградян Г.Г. (Универсам «ММ»)";"Москва г, Самуила Маршака ул, дом № 24";"Одинцово";"Гранит";"Чиграй А.С.";"КВ";"55.6387439";"37.32876";"21.04.2025";"https://durnovcev2000.kaiten.ru/32511421"
"133708";"""Вкусно Хаус""";"г.Москва, ул.Бориса Пастернака, д.17";"Одинцово";"Технологии Безопасности";"Калиниченко А.С.";"КВ";"55.6383103";"37.3256328";"21.04.2025";"https://durnovcev2000.kaiten.ru/32511411"
"ТО-177ТБ";"Общеобразовательная автономная некоммерческая организация «Обучение детей дошкольного, младшего и среднего школьного возраста» «ШКОЛА НАСЛЕДИЕ» (Школа и Детский сад)";"Московская область, Красногорский район, поселок дачного хозяйства Архангельское, 9А";"Одинцово";"Технологии Безопасности";"Саилова А.";"М";"55.7807275";"37.3015161";"18.04.2025";"https://durnovcev2000.kaiten.ru/32511950"
"1537";"ООО «ЧОУ «МЭДЖИК БИНС»/(детский сад с дошкольным образованием и секциями) Magic Beans";"село Усово, жилой комплекс Усово 8";"Одинцово";"Технологии Безопасности";"Саилова А.";"М";"55.7291393";"37.2087046";"18.04.2025";"https://durnovcev2000.kaiten.ru/32512046"
"90977";"Стоматология ""Дентал Парк""";"сп. Булатниковское, "" ЖК Бутово парк"", д.6 пом. 7";"Одинцово";"Гранит";"Калиниченко А.С.";"КВ";"55.5474901";"37.5891527";"15.04.2025";"https://durnovcev2000.kaiten.ru/32510794"
"ТО-2339";"Салон красоты ""Woman zone"" ИП Володина";"МО, д. Бутово, Бутово парк д. 2";"Одинцово";"Гранит";"-";"КВ";"55.5484702";"37.5873353";"15.04.2025";"https://durnovcev2000.kaiten.ru/32511263"
"131932";"ООО ""Планета Здоровья Холдинг"" / Аптека Планета Здоровья";"Московская обл, Ленинский городской округ, м, помещение 5. Бутово парк 19";"Одинцово";"Гранит";"Пряшников Д.Ю.";"КВ";"55.5454711";"37.5907144";"15.04.2025";"https://durnovcev2000.kaiten.ru/32510804"
"138275";"ООО ""МЕРИДИАН""";"Московская область, Бутово Парк, д. 18";"Одинцово";"Гранит";"Пряшников Д.Ю.";"КВ";"55.5456092";"37.5897228";"15.04.2025";"https://durnovcev2000.kaiten.ru/40143380"
"133100";"ООО «Арктик»/ аптека Планета Здоровья";"Москва г, Сосенское п, Скандинавский б-р, дом 8";"Одинцово";"Гранит";"Пряшников Д.Ю.";"КВ";"55.5651224";"37.4986326";"14.04.2025";"https://durnovcev2000.kaiten.ru/32511353"
"90196";"ИП Бурейко Магазин цветов ""Цветущий дворик""";"г. Москва, п. Коммунарка, ул. Липовый парк д. 11";"Одинцово";"Гранит";"Калиниченко А.С.";"КВ";"55.5662559";"37.4856285";"14.04.2025";"https://durnovcev2000.kaiten.ru/32511372"
"131590";"ИП Кореньков Алексей Вячеславович";"г. Москва, п. Коммунарка, ул. Липовый парк, д.7";"Одинцово";"Гранит";"Мозговой И.В.";"КВ";"55.5687544";"37.4907804";"14.04.2025";"https://durnovcev2000.kaiten.ru/32511380"
"131866";"ООО ""Планета Здоровья Холдинг"" Аптека Планета Здоровья";"Москва, Липовый парк 7";"Одинцово";"Гранит";"Пряшников Д.Ю.";"КВ";"55.5687544";"37.4907804";"14.04.2025";"https://durnovcev2000.kaiten.ru/32511393"
"134942";"ИП  Закирова Наила Расимовна (Сеть магазинов «Суши Стор»)";"Москва г, Сосенское п, Скандинавский б-р, дом № 3, корпус 1";"Одинцово";"Технологии Безопасности";"Калиниченко А.С.";"КВ";"55.56610269999999";"37.50044370000001";"14.04.2025";"https://durnovcev2000.kaiten.ru/32511368"
"136505";"ИП Парузина Дарья Николаевна («Центр детской нейропсихологии и логопедии «Нейроника»)";"Москва г, Сосенское п, Скандинавский б-р, дом 1, корпус 1";"Одинцово";"Технологии Безопасности";"Христенко Е.А.";"КВ";"55.5673602";"37.4975254";"14.04.2025";"https://durnovcev2000.kaiten.ru/32511363"
"137112";"ИП Новицкий Владимир Сергеевич, Кладовка ""СКЛАДНО""";"Москва г, бульвар Скандинавский, д. 5, к. 3";"Одинцово";"Технологии Безопасности";"Гаук Е.М.";"КВ";"55.5655004";"37.5009184";"14.04.2025";"https://durnovcev2000.kaiten.ru/32511354"
"133144";"ИП Крафт Ю.Н./Кафе ""Термос""";"Москва г, Сосенское п, Коммунарка п, Липовый парк ул, дом 7, помещение 25/1";"Одинцово";"Технологии Безопасности";"Мозговой И.В.";"КВ";"55.5687544";"37.4907804";"14.04.2025";"https://durnovcev2000.kaiten.ru/32511362"
"137484";"ИП Ушакова Ю.А., Пекарня «Буханка»";"г. Звенигород, район Восточный, 3-й микрорайон, 12";"Одинцово";"Технологии Безопасности";"Мозговой И.В.";"КВ";"55.7231545";"36.8721009";"11.04.2025";"https://durnovcev2000.kaiten.ru/32519890"
"91848";"ООО ""Гурман""";"МО, д. Изварино, ул. Омская, д.5, к 2";"Одинцово";"Гранит";"Калиниченко А.С.";"КВ";"55.6177247";"37.2656502";"11.04.2025";"https://durnovcev2000.kaiten.ru/32512053"
"133243";"ООО «ЦЛД Центр Лабораторной Диагностики» (""МЕДИЦИНСКИЙ ЦЕНТР ООО"" ЦЛД"")";"Московская обл, Одинцовский р-н, Горки-10 п, дом 23";"Одинцово";"Технологии Безопасности";"Христенко Е.А.";"КВ";"55.7034114";"37.0246669";"11.04.2025";"https://durnovcev2000.kaiten.ru/32512045"
"136219";"ИП Гасымова Махира Ибрагим кызы (Магазин)";"Москва г, Внуковское п, Омская ул, дом 5, офис 4";"Одинцово";"Технологии Безопасности";"Калиниченко А.С.";"КВ";"55.6177247";"37.2656502";"11.04.2025";"https://durnovcev2000.kaiten.ru/32512050"
"93051";"Аптека ""Планета Здоровья """;"МО, Одинцовский р-н, Лесной городок дп, Молодёжная д.8 пом2";"Одинцово";"Гранит";"Пряшников Д.Ю.";"М";"55.63944009999999";"37.2173555";"11.04.2025";"https://durnovcev2000.kaiten.ru/32511981"
"91237";"Аптека ""Планета Здоровья""";"МО, г. Одинцово, ул. Каштановая 10";"Одинцово";"Гранит";"Пряшников Д.Ю.";"М";"55.6543";"37.2704674";"11.04.2025";"https://durnovcev2000.kaiten.ru/32511979"
"132477";"ООО ""Планета Здоровья Холдинг"" / Аптека Планета Здоровья";"Москва г, Поляны ул, дом № 5 А, корпус 1";"Одинцово";"Гранит";"Пряшников Д.Ю.";"КВ";"55.5630103";"37.5562472";"09.04.2025";"https://durnovcev2000.kaiten.ru/32510777"
"137553";"ИП Степанова Ксения Сергеевна, Детская Академия";"Москва,ул.Изюмская,д.39к1";"Одинцово";"Технологии Безопасности";"Калиниченко А.С.";"КВ";"55.54988669999999";"37.56855669999999";"09.04.2025";"https://durnovcev2000.kaiten.ru/35684308"
"ТО- № 881ТБ";"ООО Туристическая компания ""ЖАСМИН"" / офис ООО ""Туристическая компания «Жасмин»";"Москва г, ул Южнобутовская, д. 66";"Одинцово";"Технологии Безопасности";"Христенко Е.А.";"КВ";"55.535441";"37.5248802";"09.04.2025";"https://durnovcev2000.kaiten.ru/34748001"
"90924";"ИП Ломова Любовь Викторовна Салон красоты «Beauty Room»";"г. Москва, ул. Феодосийская, дом 7, корпус 6";"Одинцово";"Гранит";"Христенко Е.А.";"КВ";"55.5589545";"37.5771236";"09.04.2025";"https://durnovcev2000.kaiten.ru/32510815"
"134813";"ИП Титов Денис Сергеевич  /Барбершоп";"Москва г, Горчакова ул, дом 11";"Одинцово";"Гранит";"Моторин А.В.";"КВ";"55.5434913";"37.5318087";"09.04.2025";"https://durnovcev2000.kaiten.ru/32510781"
"132666";"ООО «МедЛид» Медицинский офис ""Анализы ДНКОМ""";"г. Москва, б-р Дмитрия Донского, д.8, пом.6";"Одинцово";"Гранит";"Мозговой И.В.";"КВ";"55.5680723";"37.5735692";"09.04.2025";"https://durnovcev2000.kaiten.ru/32510786"
"134163";"ООО «Система»/Пекарня Буханка";"Москва г, Феодосийская ул, дом 7, корпус 1";"Одинцово";"Гранит";"Ткаченко В.Н.";"КВ";"55.5616638";"37.5777688";"09.04.2025";"https://durnovcev2000.kaiten.ru/32510813"
"93198";"ИП Урганджян Седа Гришаевна/Магазин канцтоваров ""КанцПарк""";"г. Москва, ул. Александры Монаховой д.94/2";"Одинцово";"Технологии Безопасности";"Дубовик А.С.";"КВ";"55.5421719";"37.4831062";"08.04.2025";"https://durnovcev2000.kaiten.ru/32510900"
"132897";"ООО ""Альфа""/ аптека Планета Здоровья";"Москва г, Коммунарка п, Александры Монаховой ул , дом № 92, корпус 1";"Одинцово";"Гранит";"Пряшников Д.Ю.";"КВ";"55.5700773";"37.4761883";"08.04.2025";"https://durnovcev2000.kaiten.ru/32510866"
"133182";"ИП Титов Денис Сергеевич (Барбершоп «Черная кость»)";"Москва г, Александры Монаховой, дом 88 к.3";"Одинцово";"Гранит";"Моторин А.В.";"КВ";"55.54398390000001";"37.4843793";"08.04.2025";"https://durnovcev2000.kaiten.ru/32510896"
"131378";"ИП Меладзе Марина Отаровна/Магазин Продуктов";"г. Москва, ул. Александры Монаховой, д.105, корп 1";"Одинцово";"Гранит";"Михно С.С.";"КВ";"55.5408008";"37.4954976";"08.04.2025";"https://durnovcev2000.kaiten.ru/32510875"
"130709";"ИП Кочетова Юлия Александровна, магазин ""Я РаСТУ""";"г. Москва, пос. Сосенское, п. Коммунарка, ул. Александры Монаховой, д.90, к.1";"Одинцово";"Гранит";"Мозговой И.В.";"КВ";"55.5438973";"37.4833174";"08.04.2025";"https://durnovcev2000.kaiten.ru/32510893"
"132579";"ООО ""Альфа""/ аптека Планета Здоровья";"Москва г, Александры Монаховой ул, дом № 88/3";"Одинцово";"Гранит";"Пряшников Д.Ю.";"КВ";"55.5617843";"37.4871244";"08.04.2025";"https://durnovcev2000.kaiten.ru/32510898"
"133094";"ИП Садовников Михаил Александрович (Магазин «Крымский дом»)";"Москва г, Сосенское п, Александры Монаховой ул, дом 94, корпус 2";"Одинцово";"Гранит";"Гаук Е.М.";"КВ";"55.5421719";"37.4831062";"08.04.2025";"https://durnovcev2000.kaiten.ru/32510885"
"1478";"ООО ""Парацельс";"Москва г, Александры Монаховой, 105, к. 1";"Одинцово";"Гранит";"Пряшников Д.Ю.";"КВ";"55.5408008";"37.4954976";"08.04.2025";"https://durnovcev2000.kaiten.ru/40144557"
"90703";"Аптека ""Планета Здоровья""";"г.Москва, ул. Старобитцевская 21/2";"Одинцово";"Гранит";"Пряшников Д.Ю.";"М";"55.5778604";"37.5768901";"08.04.2025";"https://durnovcev2000.kaiten.ru/32511279"
"131291";"ООО ""Группа ""ТОРРО"", Аптека Планета Здоровья";"г. Москва, п. Коммунарка, ул. Александры Монаховой, д. 99";"Одинцово";"Гранит";"Пряшников Д.Ю.";"М";"55.541117";"37.491318";"08.04.2025";"https://durnovcev2000.kaiten.ru/32511303"
"137915";"ООО «Система»/Пекарня Буханка";"МО , Ленинский гор.окр., раб.пос.Дрожжино , Южная улица, 3к2";"Одинцово";"Гранит";"Ткаченко В.Н.";"КВ";"55.5235378";"37.5821749";"07.04.2025";"https://durnovcev2000.kaiten.ru/35512582"
"151670";"ИП Басирова О.А. Пекарня «Буханка»";"МО, Ленинский р-н, д. Дрожжино, Новое шоссе, 2к2";"Одинцово";"Гранит";"Ткаченко В.Н.";"КВ";"55.5267662";"37.5846683";"07.04.2025";"https://durnovcev2000.kaiten.ru/35500147"
"132267";"ИП Шелухина Наталья Сергеевна /Пекарня Буханка";"Московская обл, Одинцовский р-н, Одинцово г, Кутузовская ул, дом № 25";"Одинцово";"Эсток-Сервис";"Ткаченко В.Н.";"КВ";"55.7020024";"37.3255308";"01.04.2025";"https://durnovcev2000.kaiten.ru/32511869"
